{
  "$schema": "https://json-schema.org/draft/2020-12/schema",
  "$id": "https://apm2.dev/schemas/apm2/security_agents_index_doc_v1.schema.json",
  "title": "SecurityAgentsIndexDocumentV1",
  "type": "object",
  "required": [
    "schema",
    "schema_version",
    "kind",
    "meta",
    "payload"
  ],
  "properties": {
    "schema": {
      "type": "string",
      "const": "apm2.security.agents_index_doc.v1"
    },
    "schema_version": {
      "type": "string",
      "pattern": "^[0-9]+\\.[0-9]+\\.[0-9]+$"
    },
    "kind": {
      "type": "string",
      "const": "security.agents_index_document"
    },
    "meta": {
      "type": "object",
      "required": [
        "canonicalizer",
        "classification",
        "created_at",
        "source_of_truth_refs",
        "stable_id",
        "status"
      ],
      "properties": {
        "stable_id": {
          "type": "string",
          "pattern": "^dcp://[a-z0-9.-]+/[A-Za-z0-9_./:-]+(@[A-Za-z0-9_.-]+)?$"
        },
        "status": {
          "type": "string",
          "enum": [
            "ACTIVE",
            "DRAFT",
            "DEPRECATED"
          ]
        },
        "classification": {
          "type": "string",
          "enum": [
            "PUBLIC",
            "INTERNAL",
            "CONFIDENTIAL",
            "RESTRICTED"
          ]
        },
        "source_of_truth_refs": {
          "type": "array",
          "minItems": 1,
          "items": {
            "type": "string",
            "minLength": 1,
            "maxLength": 256
          }
        },
        "replaces": {
          "type": "string",
          "minLength": 1,
          "maxLength": 256
        },
        "last_aligned_rfc": {
          "type": "string",
          "minLength": 1,
          "maxLength": 64
        },
        "created_at": {
          "type": "string",
          "format": "date-time"
        },
        "updated_at": {
          "type": "string",
          "format": "date-time"
        },
        "canonicalizer": {
          "type": "object",
          "required": [
            "canonicalizer_id",
            "canonicalizer_version",
            "vectors_ref"
          ],
          "properties": {
            "canonicalizer_id": {
              "type": "string",
              "minLength": 1,
              "maxLength": 128
            },
            "canonicalizer_version": {
              "type": "string",
              "pattern": "^[0-9]+\\.[0-9]+\\.[0-9]+$"
            },
            "vectors_ref": {
              "type": "string",
              "pattern": "^dcp://[a-z0-9.-]+/[A-Za-z0-9_./:-]+(@[A-Za-z0-9_.-]+)?$"
            }
          },
          "additionalProperties": false
        },
        "provenance": {
          "type": "object",
          "properties": {
            "actor_id": {
              "type": "string",
              "minLength": 1,
              "maxLength": 128
            },
            "work_id": {
              "type": "string",
              "minLength": 1,
              "maxLength": 128
            },
            "source_receipts": {
              "type": "array",
              "items": {
                "type": "string",
                "pattern": "^dcp://[a-z0-9.-]+/[A-Za-z0-9_./:-]+(@[A-Za-z0-9_.-]+)?$"
              }
            }
          },
          "additionalProperties": false
        }
      },
      "additionalProperties": false
    },
    "payload": {
      "type": "object",
      "required": [
        "title",
        "directory_purpose",
        "security_philosophy",
        "runtime_semantics_boundary",
        "documents",
        "keyless_signing_insight",
        "sources",
        "scale_profile",
        "cryptography_posture"
      ],
      "properties": {
        "title": {
          "type": "string",
          "const": "APM2 Security Documentation"
        },
        "directory_purpose": {
          "type": "string",
          "minLength": 1,
          "maxLength": 512
        },
        "security_philosophy": {
          "type": "array",
          "minItems": 1,
          "items": {
            "$ref": "#/$defs/principle"
          }
        },
        "runtime_semantics_boundary": {
          "type": "string",
          "minLength": 1,
          "maxLength": 512
        },
        "documents": {
          "type": "array",
          "minItems": 1,
          "items": {
            "$ref": "#/$defs/doc_ref"
          }
        },
        "keyless_signing_insight": {
          "type": "object",
          "required": [
            "summary",
            "traditional_flow",
            "keyless_flow",
            "outcome",
            "scope_note"
          ],
          "properties": {
            "summary": {
              "type": "string",
              "minLength": 1,
              "maxLength": 512
            },
            "traditional_flow": {
              "type": "array",
              "minItems": 1,
              "items": {
                "type": "string",
                "minLength": 1,
                "maxLength": 256
              }
            },
            "keyless_flow": {
              "type": "array",
              "minItems": 1,
              "items": {
                "type": "string",
                "minLength": 1,
                "maxLength": 256
              }
            },
            "outcome": {
              "type": "string",
              "minLength": 1,
              "maxLength": 256
            },
            "scope_note": {
              "type": "string",
              "minLength": 1,
              "maxLength": 512
            }
          },
          "additionalProperties": false
        },
        "sources": {
          "type": "array",
          "minItems": 1,
          "items": {
            "$ref": "#/$defs/source_link"
          }
        },
        "scale_profile": {
          "type": "object",
          "required": [
            "capacity_target",
            "indexing_notes"
          ],
          "properties": {
            "capacity_target": {
              "type": "string",
              "const": "multi-exabyte"
            },
            "indexing_notes": {
              "type": "array",
              "minItems": 1,
              "items": {
                "type": "string",
                "minLength": 1,
                "maxLength": 256
              }
            }
          },
          "additionalProperties": false
        },
        "cryptography_posture": {
          "type": "object",
          "required": [
            "pqc_status",
            "pqc_note"
          ],
          "properties": {
            "pqc_status": {
              "type": "string",
              "const": "DEFERRED"
            },
            "pqc_note": {
              "type": "string",
              "minLength": 1,
              "maxLength": 256
            }
          },
          "additionalProperties": false
        }
      },
      "additionalProperties": false
    }
  },
  "$defs": {
    "principle": {
      "type": "object",
      "required": [
        "name",
        "statement"
      ],
      "properties": {
        "name": {
          "type": "string",
          "minLength": 1,
          "maxLength": 64
        },
        "statement": {
          "type": "string",
          "minLength": 1,
          "maxLength": 256
        }
      },
      "additionalProperties": false
    },
    "doc_ref": {
      "type": "object",
      "required": [
        "doc_id",
        "path",
        "purpose"
      ],
      "properties": {
        "doc_id": {
          "type": "string",
          "pattern": "^SEC-DOC-[0-9]{2}$"
        },
        "path": {
          "type": "string",
          "minLength": 1,
          "maxLength": 256
        },
        "purpose": {
          "type": "string",
          "minLength": 1,
          "maxLength": 256
        }
      },
      "additionalProperties": false
    },
    "source_link": {
      "type": "object",
      "required": [
        "name",
        "url"
      ],
      "properties": {
        "name": {
          "type": "string",
          "minLength": 1,
          "maxLength": 128
        },
        "url": {
          "type": "string",
          "minLength": 1,
          "maxLength": 2048
        }
      },
      "additionalProperties": false
    }
  },
  "unevaluatedProperties": false
}
