{
  "schema": "apm2.security.agents_index_doc.v1",
  "schema_version": "1.0.0",
  "kind": "security.agents_index_document",
  "meta": {
    "stable_id": "dcp://apm2.security/doc/agents-index@1",
    "status": "ACTIVE",
    "classification": "INTERNAL",
    "source_of_truth_refs": [
      "documents/rfcs/RFC-0020/HOLONIC_SUBSTRATE_INTERFACE.md",
      "documents/security/SECURITY_POLICY.cac.json"
    ],
    "replaces": "documents/security/AGENTS.md",
    "created_at": "2026-02-05T00:00:00Z",
    "updated_at": "2026-02-05T00:00:00Z",
    "last_aligned_rfc": "RFC-0020",
    "canonicalizer": {
      "canonicalizer_id": "apm2.canonicalizer.jcs",
      "canonicalizer_version": "1.0.0",
      "vectors_ref": "dcp://apm2.cac/canonicalizer/vectors@v1"
    },
    "provenance": {
      "actor_id": "HOLON-SECURITY-GOVERNANCE",
      "work_id": "DOC-SECURITY-RFC0020-ALIGN-20260205",
      "source_receipts": []
    }
  },
  "payload": {
    "title": "APM2 Security Documentation",
    "directory_purpose": "This directory contains security guidelines and operational procedures for APM2.",
    "security_philosophy": [
      {
        "name": "Fail-closed",
        "statement": "When in doubt, deny access or abort operations."
      },
      {
        "name": "Defense in depth",
        "statement": "Enforce multiple independent protection layers."
      },
      {
        "name": "Minimal secrets",
        "statement": "Use keyless signing to eliminate long-lived signing key custody."
      },
      {
        "name": "Transparent verification",
        "statement": "Release verification is publicly auditable."
      }
    ],
    "runtime_semantics_boundary": "Protocol and runtime trust semantics are defined by RFC-0020; this directory translates those semantics into operational procedures.",
    "documents": [
      {
        "doc_id": "SEC-DOC-01",
        "path": "documents/security/SECURITY_POLICY.cac.json",
        "purpose": "Security modes, invariants, and enforcement posture."
      },
      {
        "doc_id": "SEC-DOC-02",
        "path": "documents/security/SIGNING_AND_VERIFICATION.cac.json",
        "purpose": "Keyless release signing and verification procedures."
      },
      {
        "doc_id": "SEC-DOC-03",
        "path": "documents/security/RELEASE_PROCEDURE.cac.json",
        "purpose": "High-assurance release workflow and required gates."
      },
      {
        "doc_id": "SEC-DOC-04",
        "path": "documents/security/SECRETS_MANAGEMENT.cac.json",
        "purpose": "Credential custody, distribution, redaction, and leak response controls."
      },
      {
        "doc_id": "SEC-DOC-05",
        "path": "documents/security/INCIDENT_RESPONSE.cac.json",
        "purpose": "Incident severity model, playbooks, and closure criteria."
      },
      {
        "doc_id": "SEC-DOC-06",
        "path": "documents/security/THREAT_MODEL.cac.json",
        "purpose": "Threat classes, adversary assumptions, and required controls."
      },
      {
        "doc_id": "SEC-DOC-07",
        "path": "documents/security/NETWORK_DEFENSE.cac.json",
        "purpose": "Network-focused threat matrix and control bindings."
      },
      {
        "doc_id": "SEC-DOC-08",
        "path": "documents/security/SECURITY_CHECKLIST.cac.json",
        "purpose": "Operational pre-merge and release security verification checklist."
      },
      {
        "doc_id": "SEC-DOC-09",
        "path": "documents/security/consensus-runbook.cac.json",
        "purpose": "Consensus-layer incident, diagnostics, and recovery runbook."
      }
    ],
    "keyless_signing_insight": {
      "summary": "Cosign keyless signing removes long-lived signing-key storage from release operations.",
      "traditional_flow": [
        "Generate signing keys.",
        "Store private key securely.",
        "Rotate keys periodically.",
        "Accept long-lived key compromise risk."
      ],
      "keyless_flow": [
        "GitHub Actions obtains OIDC identity token.",
        "Sigstore Fulcio issues short-lived certificate.",
        "Artifact is signed with ephemeral key.",
        "Signing event is logged in Rekor transparency log."
      ],
      "outcome": "No long-lived signing keys to store, rotate, or protect.",
      "scope_note": "Keyless signing secures release artifacts only; runtime inter-holon authority uses RFC-0020 identity and receipt authentication semantics."
    },
    "sources": [
      {
        "name": "Sigstore Cosign Keyless Signing",
        "url": "https://docs.sigstore.dev/cosign/signing/overview/"
      },
      {
        "name": "GitHub Actions Security Best Practices",
        "url": "https://docs.github.com/en/actions/security-guides/security-hardening-for-github-actions"
      },
      {
        "name": "SLSA Framework",
        "url": "https://slsa.dev/"
      }
    ],
    "scale_profile": {
      "capacity_target": "multi-exabyte",
      "indexing_notes": [
        "RFC-0020 requirement coverage is maintained in SECURITY_POLICY and SECURITY_CHECKLIST artifacts via inline requirement evidence references and gap notes.",
        "References should point to structured CAC documents for deterministic retrieval and enforcement.",
        "Security documentation index must remain machine-readable for large-scale automation and policy checking."
      ]
    },
    "cryptography_posture": {
      "pqc_status": "DEFERRED",
      "pqc_note": "PQC migration is deferred in current security-document indexing and release-signing guidance."
    }
  }
}
